LANGUAGE,"English","French","Spanish","Italian"


STRC_08r01,"November One to November Two. Get that engine running, but wait for the troops to finish boarding the transports.","November Un à November Deux. Lancez le moteur, mais attendez que les soldats aient fini d'embarquer dans les transports.","November Uno a November Dos. Arrancad ese motor, pero esperar a que embarquen las tropas.","November Uno a November Due. Tieni acceso il motore, ma aspetta che le truppe finiscano di salire a bordo."
STRC_08r02,"This is Oscar Two. We have all troops on board. Ready to move out.","Ici Oscar Deux. Tous les hommes sont à bord. Prêt à faire mouvement.","Aquí Oscar Dos. Todas las tropas a bordo. Listos para marchar.","Qui Oscar Due. Tutte le truppe a bordo. Pronti ad andarcene."
STRC_08r03,"November Two, you're deviating from course. Return to formation immediately!","November Deux, vous déviez de l'itinéraire. Reprenez immédiatement la formation !","November Dos, os desviáis de la ruta. ¡Volved inmediatamente a la formación!","November Due, ti stai allontanando dalla rotta. Ritorna subito in formazione!"
STRC_08r04,"November Two, this is your last warning. Return to formation, or you will be reported.","November Deux, dernier avertissement. Regagnez la formation ou vous aurez un rapport.","November Dos, es vuestro último aviso. Volved a la formación o daré parte.","November Due, questo è l’ultimo avvertimento. Ritorna immediatamente in formazione!"
STRC_08r05,"Oscar One and Two approaching the Tandag Base LZ. All units, prepare for insertion.","Oscar Un et Oscar Deux en approche de la LZ de la base Tandag. À toutes les unités, préparez-vous pour insertion.","Oscar Uno y Dos acercándose a la zona de aterrizaje de la base Tandag. Todas las unidades, preparadas para inserción","Oscar Uno e Due in avvicinamento alla zona d’atterraggio della Base Tandag. A tutte le unità, pronti all’inserzione."
STRC_08r06,"Both chalks on site. Oscar One and Two RTB.","Les deux unités sont sur site. Oscar Un et Deux rentrent à la base.","Ambos objetivos en el lugar. Oscar Uno y Dos, a la base.","Entrambe le unità sul posto. Oscar Uno e Due ritornano alla base."
STRC_08r07,"November Two, stay on site to provide support to the troops on the ground. Looks like they'll need it. I'm escorting Oscar Flight back to base. November One out.","November Deux, restez sur place pour appuyer les troupes au sol. On dirait qu'elles vont en avoir besoin. Je ramène la patrouille Oscar à la base. November Un, terminé.","November Dos, manteneos en la zona para apoyar a las tropas de tierra. Parece que van a necesitarlo. Vamos a escoltar al vuelo Oscar hasta la base. November Uno, corto.","November Due, resta in zona e aiuta le truppe a terra: ne hanno bisogno. Io sto scortando la pattuglia Oscar alla base. November Uno, chiudo."
STRC_08r08,"Tandag Base to November. Enemy troops are about to breach the perimeter. Focus your fire on the biggest troop concentrations or we won't be able to hold out much longer! Tandag Base out.","Base Tandag à November. L'ennemi est sur le point d'enfoncer le périmètre. Concentrez vos tirs sur les plus importants groupements ennemis ou nous ne tiendrons plus très longtemps ! Base Tandag, terminé.","Base Tandag a November. Las tropas enemigas están a punto de cruzar el perímetro. ¡Disparad a las principales concentraciones de tropas, si no no podremos resistir! Base Tandag, corto.","Base Tandag a November. Truppe nemiche stanno aprendo una breccia nel perimetro. Concentra il fuoco sul grosso delle truppe o non riusciremo a reggere ancora a lungo! Base Tandag chiudo."
STRC_08r09,"Tandag Base to November. Enemy troops have breached our perimeter. I say again, enemy troops have ..","Base Tandag à November. L'ennemi est entré dans le périmètre. Je répète, l'ennemi est...","Base Tandag a November. Las tropas enemigas han cruzado nuestro perímetro. Repito: las tropas enemigas han...","Base Tandag a November. Le truppe nemiche hanno aperto una breccia. Ripeto, le truppe nemiche..."
STRC_08r10,"Crossroad to November. Tandag Base reports all enemy forces are pulling back. An armor platoon is enroute to launch a counter attack on their expected rendezvous point. Land at the Tandag helipad to rearm, and continue to support the tanks heading East. Crossroad out.","Crossroad à November. La base Tandag annonce que toutes les forces ennemies se replient. Un peloton blindé est en chemin pour lancer une contre-attaque sur le point de jonction estimé de l'ennemi. Posez-vous sur la plate-forme de Tandag pour réarmer et repartez appuyer les chars en route vers l'est. Crossroad, terminé.","Crossroad a November. La base Tandag afirma que las fuerzas enemigas se retiran. Una sección de blindajes va a lanzar un contraataque en el punto de encuentro. Aterrizad en el helipuerto de Tandag para recargar armas, y continuad para reforzar a los tanques hacia el este. Crossroad, corto.","Crossroad a November. La Base Tandag riferisce che i nemici stanno arretrando. Un plotone di blindati è in marcia per lanciare un contrattacco sul punto d’incontro nemico. Atterra sulla piattaforma di Tandag per il riarmo e vai ad aiutare i carri armati diretti a est. Chiudo."
STRC_08r11,"Yankee One to November. Where the hell is that air support? We're getting pounded down here! Out.","Yankee Un à November. Où est cet appui aérien ? On se fait laminer, ici ! Terminé.","Yankee Uno a November. ¿Dónde están los refuerzos aéreos? ¡Van a acabar con nosotros! Corto.","Yankee Uno a November. Dov’è il supporto aereo? Ci stanno massacrando! Chiudo."
STRC_08r12,"Yankee One to Crossroad. The area has been secured. Out.","Yankee Un à Crossroad. La zone a été nettoyée. Terminé.","Yankee Uno a Crossroad. La zona está asegurada. Corto.","Yankee Uno a Crossroad. L’area è sotto controllo. Chiudo."
STRC_08r13,"Crossroad to November. Good job out there. Land at Tandag base for debriefing. Crossroad out.","Crossroad à November. Beau travail. Posez-vous à la base Tandag pour débriefing. Crossroad, terminé.","Crossroad a November. Buen trabajo. Aterrizad en la base Tandag para informar. Crossroad, corto.","Crossroad a November. Bel lavoro. Atterra a Tandag e presentati a rapporto. Crossroad chiudo."
STRC_08m01,"Heli Base","Base hélicos","Helipuerto","Base elicotteri"
STRC_08m02,"Tandag Base","Base Tandag","Base Tandag","Base Tandag"
STRC_08m03,"Enemy Base","Base ennemie","Base enemiga","Base nemica"
STRC_08m04,"Battlefield","Champ de bataille","Campo de batalla","Campo di battaglia"
STRC_08m05,"Enemy attack","Attaque ennemie","Ataque enemigo","Attacco nemico"
STRC_08w01,"TANDAG BASE","BASE TANDAG","BASE TANDAG","BASE TANDAG"
STRC_08w02,"ENEMY BASE","BASE ENNEMIE","BASE ENEMIGA","BASE NEMICA"
STRC_08w03,"SUPPORT US DEFENCE","APPUYER LA DÉFENSE US","APOYA LA DEFENSA DE EE.UU.","APPOGGIA LA DIFESA USA"
STRC_08w04,"SUPPORT US ATTACK","APPUYER L'ATTAQUE US","APOYA EL ATAQUE DE EE.UU.","APPOGGIA L’ATTACCO USA"
STR_08_NAME,"Gryphons","Griffons","Grifones","Grifoni"
STR_08_OnLoad,"The Great Battle","La grande bataille","La gran batalla","La grande battaglia"
STRCAMP_End,"Mission Completed","Mission accomplie","Misión cumplida","Missione completata"
STRC_07an01,"USMC AH-1W Gunship Pilot\nMarine Attack Helicopter Squadron","USMC, pilote d'AH-1W\nEscadrille d'hélicoptères d'attaque des Marines","Piloto de nave de combate USMC AH-1W\nEscuadrón, helicópteros de ataque de los marines","Pilota elicottero AH-1W\nSquadriglia elicotteri d’attacco dei Marine"
